Sheet: 2013 points
A1: Name | B1: Class | C1: Not the Artist | D1: Superhero Boogie | E1: Orphan Train | F1: Lekker Mann | G1: Waiting Room | H1: Triggered | I1: Sweet Lowdown | J1: Cassandra's Gift | K1: TD | L1: AD | M1: DD | N1: Board | O1: Board Member | P1: 100 bonus | Q1: 2013 Total | R1: Member 2014 | S1: Previous Lifetime Total | T1: Current Lifetime Total
A2: Andrew Miller-Rhoads | D2: 150 | H2: 200 | I2: 150 | J2: 50 | Q2: =SUM(RC[-15]:RC[-1]) -> 550 | R2: Yes | S2: ? 850+ | T2: ? 1400+
A3: Benjamin Otto | D3: 200 | E3: 200 | J3: 300 | K3: 100 | O3: 400 | Q3: =SUM(RC[-15]:RC[-1]) -> 1200 | R3: Yes | S3: 700 | T3: =SUM(RC[-3]:RC[-1]) -> 1900
A4: Betsy Wood | I4: 200 | J4: 150 | M4: 50 | Q4: =SUM(RC[-15]:RC[-1]) -> 400 | R4: Yes | S4: 1200 | T4: =SUM(RC[-3]:RC[-1]) -> 1600
A5: Callen Harty | H5: 300 | M5: 100 | Q5: =SUM(RC[-15]:RC[-1]) -> 400 | R5: Yes | S5: 7700 | T5: =SUM(RC[-3]:RC[-1]) -> 8100
A6: Christan Cook | B6: 300 | J6: 200 | Q6: =SUM(RC[-15]:RC[-1]) -> 500 | R6: Yes | S6: 850 | T6: =SUM(RC[-3]:RC[-1]) -> 1350
A7: Dan Myers | D7: 200 | I7: 100 | J7: 150 | Q7: =SUM(RC[-15]:RC[-1]) -> 450 | R7: Yes | S7: 750 | T7: =SUM(RC[-3]:RC[-1]) -> 1200
A8: Don Dexter | C8: 200 | I8: 300 | L8: 50 | M8: 50 | Q8: =SUM(RC[-15]:RC[-1]) -> 600 | R8: Yes | S8: 800 | T8: =SUM(RC[-3]:RC[-1]) -> 1400
A9: Dustin Eyestone | K9: 100 | N9: 300 | Q9: =SUM(RC[-15]:RC[-1]) -> 400 | R9: Yes | S9: 300 | T9: =SUM(RC[-3]:RC[-1]) -> 700
A10: Eric Holz | B10: 300 | F10: 150 | H10: 250 | K10: 25 | L10: 150 | O10: 400 | P10: 100 | Q10: =SUM(RC[-15]:RC[-1]) -> 1375 | R10: Yes | S10: 890 | T10: =SUM(RC[-3]:RC[-1]) -> 2265
A11: Fred Allen Self | B11: 300 | G11: 125 | Q11: =SUM(RC[-15]:RC[-1]) -> 425 | R11: Yes | S11: 0 | T11: =SUM(RC[-3]:RC[-1]) -> 425
A12: Heather Renken | C12: 300 | G12: 200 | J12: 50 | O12: 400 | P12: 100 | Q12: =SUM(RC[-15]:RC[-1]) -> 1050 | R12: Yes | S12: 10125 | T12: =SUM(RC[-3]:RC[-1]) -> 11175
A13: Jan Levine Thal | J13: 300 | L13: 200 | M13: 50 | O13: 400 | P13: 100 | Q13: =SUM(RC[-15]:RC[-1]) -> 1050 | R13: Yes | S13: 3975 | T13: =SUM(RC[-3]:RC[-1]) -> 5025
A14: Jaz Campbell | J14: 300 | N14: 100 | Q14: =SUM(RC[-15]:RC[-1]) -> 400 | R14: Yes | S14: 400 | T14: =SUM(RC[-3]:RC[-1]) -> 800
A15: Joe Lutz | B15: 50 | C15: 200 | F15: 50 | I15: 50 | J15: 50 | L15: 100 | M15: 200 | O15: 400 | P15: 100 | Q15: =SUM(RC[-15]:RC[-1]) -> 1200 | R15: Yes | S15: 5025 | T15: =SUM(RC[-3]:RC[-1]) -> 6225
A16: John Renken | L16: 375 | M16: 100 | Q16: 475 | R16: Yes | S16: 775 | T16: =SUM(RC[-3]:RC[-1]) -> 1250
A17: John Siewert | I17: 300 | P17: 100 | Q17: =SUM(RC[-15]:RC[-1]) -> 400 | R17: Yes | S17: 1000 | T17: =SUM(RC[-3]:RC[-1]) -> 1400
A18: Kate Boomsa | C18: 200 | L18: 150 | M18: 50 | P18: 100 | Q18: =SUM(RC[-15]:RC[-1]) -> 500 | R18: Yes | S18: 3175 | T18: =SUM(RC[-3]:RC[-1]) -> 3675
A19: Luke Kokinos | C19: 100 | D19: 300 | E19: 150 | F19: 100 | J19: 300 | K19: 200 | O19: 400 | P19: 100 | Q19: =SUM(RC[-15]:RC[-1]) -> 1650 | R19: Yes | S19: 1025 | T19: =SUM(RC[-3]:RC[-1]) -> 2675
A20: Manny Jones | C20: 200 | G20: 300 | I20: 150 | Q20: =SUM(RC[-15]:RC[-1]) -> 650 | R20: Yes | S20: 4350 | T20: =SUM(RC[-3]:RC[-1]) -> 5000
A21: Mary Fairweather Dexter | I21: 300 | L21: 50 | M21: 50 | Q21: =SUM(RC[-15]:RC[-1]) -> 400 | R21: Yes | S21: 400 | T21: =SUM(RC[-3]:RC[-1]) -> 800
A22: Matt Defour | I22: 300 | L22: 50 | M22: 100 | Q22: =SUM(RC[-15]:RC[-1]) -> 450 | R22: Yes | S22: 0 | T22: =SUM(RC[-3]:RC[-1]) -> 450
A23: Malissa Petterson (Lamont) | C23: 300 | L23: 150 | Q23: =SUM(RC[-15]:RC[-1]) -> 450 | R23: Yes | S23: 325 | T23: =SUM(RC[-3]:RC[-1]) -> 775
A24: Nancy Craig | E24: 250 | J24: 150 | Q24: =SUM(RC[-15]:RC[-1]) -> 400 | R24: Yes | S24: 1750 | T24: =SUM(RC[-3]:RC[-1]) -> 2150
A25: Rob Matsushita | D25: 300 | I25: 150 | Q25: =SUM(RC[-15]:RC[-1]) -> 450 | R25: Yes | S25: 1750 | T25: =SUM(RC[-3]:RC[-1]) -> 2200
A26: Ryan Smith | F26: 300 | L26: 50 | M26: 50 | Q26: =SUM(RC[-15]:RC[-1]) -> 400 | R26: Yes | S26: 0 | T26: =SUM(RC[-3]:RC[-1]) -> 400
A27: Scott Feiner | H27: 150 | K27: 75 | L27: 100 | M27: 200 | O27: 400 | P27: 100 | Q27: =SUM(RC[-15]:RC[-1]) -> 1025 | R27: Yes | S27: 6485 | T27: =SUM(RC[-3]:RC[-1]) -> 7510
A28: Taylor Kokinos | D28: 150 | F28: 150 | J28: 100 | K28: 250 | O28: 400 | P28: 100 | Q28: =SUM(RC[-15]:RC[-1]) -> 1150 | R28: Yes | S28: 2825 | T28: =SUM(RC[-3]:RC[-1]) -> 3975
A29: Tim Graf | H29: 200 | J29: 200 | Q29: =SUM(RC[-15]:RC[-1]) -> 400 | R29: Yes | S29: 0 | T29: =SUM(RC[-3]:RC[-1]) -> 400
A30: Tracy Smith | F30: 300 | L30: 50 | M30: 50 | Q30: =SUM(RC[-15]:RC[-1]) -> 400 | R30: Yes | S30: 600 | T30: =SUM(RC[-3]:RC[-1]) -> 1000
A31: Tyler Falco Schott | B31: 300 | G31: 150 | J31: 300 | Q31: =SUM(RC[-15]:RC[-1]) -> 750 | R31: Yes | S31: ? 200+ | T31: ? 950+
A32: Aaron Boehm | J32: 50 | Q32: =SUM(RC[-15]:RC[-1]) -> 50 | S32: 0 | T32: =SUM(RC[-3]:RC[-1]) -> 50
A33: Aaron Nemoye | E33: 200 | Q33: =SUM(RC[-15]:RC[-1]) -> 200 | S33: 0 | T33: =SUM(RC[-3]:RC[-1]) -> 200
A34: Adam Williams | C34: 200 | Q34: =SUM(RC[-15]:RC[-1]) -> 200 | S34: 0 | T34: =SUM(RC[-3]:RC[-1]) -> 200
A35: Aja Heuss | J35: 50 | Q35: =SUM(RC[-15]:RC[-1]) -> 50 | S35: 0 | T35: =SUM(RC[-3]:RC[-1]) -> 50
A36: Al Hart | D36: 150 | Q36: =SUM(RC[-15]:RC[-1]) -> 150 | S36: 150 | T36: =SUM(RC[-3]:RC[-1]) -> 300
A37: Alan Dean Foster | D37: 50 | Q37: =SUM(RC[-15]:RC[-1]) -> 50 | S37: 0 | T37: =SUM(RC[-3]:RC[-1]) -> 50
A38: Alex Soglin | E38: 250 | Q38: =SUM(RC[-15]:RC[-1]) -> 250 | S38: 0 | T38: =SUM(RC[-3]:RC[-1]) -> 250
A39: Ali Lemus | D39: 200 | Q39: =SUM(RC[-15]:RC[-1]) -> 200 | S39: 200 | T39: =SUM(RC[-3]:RC[-1]) -> 400
A40: Alicia McCanna | F40: 200 | Q40: =SUM(RC[-15]:RC[-1]) -> 200 | S40: 400 | T40: =SUM(RC[-3]:RC[-1]) -> 600
A41: Andrea Kleiner | I41: 250 | Q41: =SUM(RC[-15]:RC[-1]) -> 250 | S41: 150 | T41: =SUM(RC[-3]:RC[-1]) -> 400
A42: Andy Lindgren | G42: 100 | I42: 200 | Q42: =SUM(RC[-15]:RC[-1]) -> 300 | S42: 50 | T42: =SUM(RC[-3]:RC[-1]) -> 350
A43: Ann Blust | B43: 300 | Q43: =SUM(RC[-15]:RC[-1]) -> 300 | S43: 0 | T43: =SUM(RC[-3]:RC[-1]) -> 300
A44: Arthur Korb | D44: 100 | Q44: =SUM(RC[-15]:RC[-1]) -> 100 | S44: 0 | T44: =SUM(RC[-3]:RC[-1]) -> 100
A45: Aurelia Khorsand | I45: 200 | Q45: =SUM(RC[-15]:RC[-1]) -> 200 | S45: 0 | T45: =SUM(RC[-3]:RC[-1]) -> 200
A46: Autumn Shiley | I46: 100 | J46: 100 | P46: 100 | Q46: =SUM(RC[-15]:RC[-1]) -> 300 | S46: 1775 | T46: =SUM(RC[-3]:RC[-1]) -> 2075
A47: Ben Doran | I47: 200 | L47: 100 | M47: 50 | Q47: =SUM(RC[-15]:RC[-1]) -> 350 | S47: 5250 | T47: =SUM(RC[-3]:RC[-1]) -> 5600
A48: Ben Wydeven | G48: 150 | Q48: =SUM(RC[-15]:RC[-1]) -> 150 | S48: 0 | T48: =SUM(RC[-3]:RC[-1]) -> 150
A49: Betty Diamond | J49: 50 | Q49: =SUM(RC[-15]:RC[-1]) -> 50 | S49: 0 | T49: =SUM(RC[-3]:RC[-1]) -> 50
A50: Brandon Barwick | H50: 50 | Q50: =SUM(RC[-15]:RC[-1]) -> 50 | S50: 1200 | T50: =SUM(RC[-3]:RC[-1]) -> 1250
A51: Brendan Hartman | K51: 225 | Q51: =SUM(RC[-15]:RC[-1]) -> 225 | S51: 1475 | T51: =SUM(RC[-3]:RC[-1]) -> 1700
A52: Brent West | E52: 200 | Q52: =SUM(RC[-15]:RC[-1]) -> 200 | S52: 1125 | T52: =SUM(RC[-3]:RC[-1]) -> 1325
A53: Brian Hill | G53: 100 | Q53: =SUM(RC[-15]:RC[-1]) -> 100 | S53: 0 | T53: =SUM(RC[-3]:RC[-1]) -> 100
A54: Brian Wild | C54: 150 | H54: 150 | Q54: =SUM(RC[-15]:RC[-1]) -> 300 | S54: 9800 | T54: =SUM(RC[-3]:RC[-1]) -> 10100
A55: Bronwyn Valley | J55: 50 | Q55: =SUM(RC[-15]:RC[-1]) -> 50 | S55: 0 | T55: =SUM(RC[-3]:RC[-1]) -> 50
A56: Bryan Royston | G56: 200 | Q56: =SUM(RC[-15]:RC[-1]) -> 200 | S56: 0 | T56: =SUM(RC[-3]:RC[-1]) -> 200
A57: Catlin Higgins | G57: 100 | Q57: =SUM(RC[-15]:RC[-1]) -> 100 | S57: 0 | T57: =SUM(RC[-3]:RC[-1]) -> 100
A58: Caty Magnuson | G58: 125 | Q58: =SUM(RC[-15]:RC[-1]) -> 125 | S58: 0 | T58: =SUM(RC[-3]:RC[-1]) -> 125
A59: Chelsea Dinegan Davis | H59: 200 | Q59: =SUM(RC[-15]:RC[-1]) -> 200 | S59: 0 | T59: =SUM(RC[-3]:RC[-1]) -> 200
A60: Christina Beller | K60: 75 | Q60: =SUM(RC[-15]:RC[-1]) -> 75 | S60: 4600 | T60: =SUM(RC[-3]:RC[-1]) -> 4675
A61: Clarice Lafayette | H61: 200 | J61: 50 | Q61: =SUM(RC[-15]:RC[-1]) -> 250 | S61: 0 | T61: =SUM(RC[-3]:RC[-1]) -> 250
A62: Collin Erickson | L62: 50 | M62: 50 | P62: 100 | Q62: =SUM(RC[-15]:RC[-1]) -> 200 | S62: 5300 | T62: =SUM(RC[-3]:RC[-1]) -> 5500
A63: Colman | B63: 250 | Q63: =SUM(RC[-15]:RC[-1]) -> 250 | S63: 0 | T63: =SUM(RC[-3]:RC[-1]) -> 250
A64: D B Petersen | J64: 200 | Q64: =SUM(RC[-15]:RC[-1]) -> 200 | S64: 0 | T64: =SUM(RC[-3]:RC[-1]) -> 200
A65: Dace | G65: 125 | Q65: =SUM(RC[-15]:RC[-1]) -> 125 | S65: 0 | T65: =SUM(RC[-3]:RC[-1]) -> 125
A66: Dana Pellebon | D66: 300 | Q66: =SUM(RC[-15]:RC[-1]) -> 300 | S66: 1200 | T66: =SUM(RC[-3]:RC[-1]) -> 1500
A67: Devorah Sherman | J67: 150 | Q67: =SUM(RC[-15]:RC[-1]) -> 150 | S67: 0 | T67: =SUM(RC[-3]:RC[-1]) -> 150
A68: Diego Nieto | E68: 200 | Q68: =SUM(RC[-15]:RC[-1]) -> 200 | S68: 0 | T68: =SUM(RC[-3]:RC[-1]) -> 200
A69: Donnovan Moen | I69: 200 | Q69: =SUM(RC[-15]:RC[-1]) -> 200 | S69: 0 | T69: =SUM(RC[-3]:RC[-1]) -> 200
A70: Drew Palasini | J70: 100 | Q70: =SUM(RC[-15]:RC[-1]) -> 100 | S70: 0 | T70: =SUM(RC[-3]:RC[-1]) -> 100
A71: Eilish Valley | J71: 50 | Q71: =SUM(RC[-15]:RC[-1]) -> 50 | S71: 0 | T71: =SUM(RC[-3]:RC[-1]) -> 50
A72: Elizabeth Robbins | E72: 200 | Q72: =SUM(RC[-15]:RC[-1]) -> 200 | S72: 0 | T72: =SUM(RC[-3]:RC[-1]) -> 200
A73: Emily Melo | I73: 200 | Q73: =SUM(RC[-15]:RC[-1]) -> 200 | S73: 0 | T73: =SUM(RC[-3]:RC[-1]) -> 200
A74: Erin Ronayne | F74: 200 | Q74: =SUM(RC[-15]:RC[-1]) -> 200 | S74: 0 | T74: =SUM(RC[-3]:RC[-1]) -> 200
A75: Frances Olson-Avina | E75: 200 | Q75: =SUM(RC[-15]:RC[-1]) -> 200 | S75: 0 | T75: =SUM(RC[-3]:RC[-1]) -> 200
A76: Grace Grindrod-Feeny | D76: 200 | Q76: =SUM(RC[-15]:RC[-1]) -> 200 | S76: 850 | T76: =SUM(RC[-3]:RC[-1]) -> 1050
A77: Greg Johnson | K77: 50 | Q77: =SUM(RC[-15]:RC[-1]) -> 50 | S77: 5650 | T77: =SUM(RC[-3]:RC[-1]) -> 5700
A78: Heidi Hakseth | I78: 200 | Q78: =SUM(RC[-15]:RC[-1]) -> 200 | S78: 0 | T78: =SUM(RC[-3]:RC[-1]) -> 200
A79: Ingrid Kallick | J79: 300 | Q79: =SUM(RC[-15]:RC[-1]) -> 300 | S79: 2850 | T79: =SUM(RC[-3]:RC[-1]) -> 3150
A80: Jacob Nelson | G80: 225 | Q80: =SUM(RC[-15]:RC[-1]) -> 225 | S80: 0 | T80: =SUM(RC[-3]:RC[-1]) -> 225
A81: Jake Severson | K81: 75 | N81: 250 | Q81: =SUM(RC[-15]:RC[-1]) -> 325 | S81: 0 | T81: =SUM(RC[-3]:RC[-1]) -> 325
A82: Japhy Wright-Miller | E82: 200 | Q82: =SUM(RC[-15]:RC[-1]) -> 200 | S82: 0 | T82: =SUM(RC[-3]:RC[-1]) -> 200
A83: Jason Compton | G83: 200 | Q83: =SUM(RC[-15]:RC[-1]) -> 200 | S83: 200 | T83: =SUM(RC[-3]:RC[-1]) -> 400
A84: Jason Ocker | G84: 100 | Q84: =SUM(RC[-15]:RC[-1]) -> 100 | S84: 0 | T84: =SUM(RC[-3]:RC[-1]) -> 100
A85: Jeff Klem | B85: 200 | Q85: =SUM(RC[-15]:RC[-1]) -> 200 | S85: 0 | T85: =SUM(RC[-3]:RC[-1]) -> 200
A86: Jenna Side | G86: 250 | Q86: =SUM(RC[-15]:RC[-1]) -> 250 | S86: 0 | T86: =SUM(RC[-3]:RC[-1]) -> 250
A87: Jennifer Russ | J87: 50 | Q87: =SUM(RC[-15]:RC[-1]) -> 50 | S87: 1250 | T87: =SUM(RC[-3]:RC[-1]) -> 1300
A88: John Morgan | I88: 200 | Q88: =SUM(RC[-15]:RC[-1]) -> 200 | S88: 0 | T88: =SUM(RC[-3]:RC[-1]) -> 200
A89: Josh Epstein | D89: 200 | Q89: =SUM(RC[-15]:RC[-1]) -> 200 | S89: 0 | T89: =SUM(RC[-3]:RC[-1]) -> 200
A90: Juli Johnson | J90: 200 | Q90: =SUM(RC[-15]:RC[-1]) -> 200 | S90: 0 | T90: =SUM(RC[-3]:RC[-1]) -> 200
A91: Justin Schober | L91: 300 | Q91: =SUM(RC[-15]:RC[-1]) -> 300 | S91: 300 | T91: =SUM(RC[-3]:RC[-1]) -> 600
A92: Kären Miskimen | H92: 150 | Q92: =SUM(RC[-15]:RC[-1]) -> 150 | S92: 0 | T92: =SUM(RC[-3]:RC[-1]) -> 150
A93: Kathleen Magnuson | F93: 100 | Q93: =SUM(RC[-15]:RC[-1]) -> 100 | S93: 0 | T93: =SUM(RC[-3]:RC[-1]) -> 100
A94: Katie Ramos | D94: 150 | Q94: =SUM(RC[-15]:RC[-1]) -> 150 | S94: 0 | T94: =SUM(RC[-3]:RC[-1]) -> 150
A95: Kay Hoel | E95: 200 | Q95: =SUM(RC[-15]:RC[-1]) -> 200 | S95: 0 | T95: =SUM(RC[-3]:RC[-1]) -> 200
A96: Kayla Stelzel | B96: 200 | Q96: =SUM(RC[-15]:RC[-1]) -> 200 | S96: 0 | T96: =SUM(RC[-3]:RC[-1]) -> 200
A97: Kelly Fitzgerald | J97: 50 | Q97: =SUM(RC[-15]:RC[-1]) -> 50 | S97: 0 | T97: =SUM(RC[-3]:RC[-1]) -> 50
A98: Kelly Maxwell | D98: 200 | Q98: =SUM(RC[-15]:RC[-1]) -> 200 | S98: 0 | T98: =SUM(RC[-3]:RC[-1]) -> 200
A99: Kurt Mc Ginnis Brown | C99: 250 | Q99: =SUM(RC[-15]:RC[-1]) -> 250 | S99: 0 | T99: =SUM(RC[-3]:RC[-1]) -> 250
A100: Laura Detert | L100: 300 | Q100: =SUM(RC[-15]:RC[-1]) -> 300 | S100: 300 | T100: =SUM(RC[-3]:RC[-1]) -> 600
A101: Lindsey Hoe-Neds | E101: 300 | Q101: =SUM(RC[-15]:RC[-1]) -> 300 | S101: 200 | T101: =SUM(RC[-3]:RC[-1]) -> 500
A102: Mari Mitchell | J102: 150 | Q102: =SUM(RC[-15]:RC[-1]) -> 150 | S102: 0 | T102: =SUM(RC[-3]:RC[-1]) -> 150
A103: Marty Peters | I103: 200 | Q103: =SUM(RC[-15]:RC[-1]) -> 200 | S103: 0 | T103: =SUM(RC[-3]:RC[-1]) -> 200
A104: Mary Conroy | J104: 50 | Q104: =SUM(RC[-15]:RC[-1]) -> 50 | S104: 0 | T104: =SUM(RC[-3]:RC[-1]) -> 50
A105: Matt Haag | B105: 300 | Q105: =SUM(RC[-15]:RC[-1]) -> 300 | S105: 0 | T105: =SUM(RC[-3]:RC[-1]) -> 300
A106: Matt Kenyon | N106: 300 | Q106: =SUM(RC[-15]:RC[-1]) -> 300 | S106: 7925 | T106: =SUM(RC[-3]:RC[-1]) -> 8225
A107: Maurice Longino | G107: 200 | Q107: =SUM(RC[-15]:RC[-1]) -> 200 | S107: 0 | T107: =SUM(RC[-3]:RC[-1]) -> 200
A108: Megan Duster | I108: 150 | Q108: =SUM(RC[-15]:RC[-1]) -> 150 | S108: 0 | T108: =SUM(RC[-3]:RC[-1]) -> 150
A109: Michael A Levine | J109: 50 | Q109: =SUM(RC[-15]:RC[-1]) -> 50 | S109: 0 | T109: =SUM(RC[-3]:RC[-1]) -> 50
A110: Michael Tooher | G110: 250 | Q110: 250 | S110: 250 | T110: =SUM(RC[-3]:RC[-1]) -> 500
A111: Miranda Beadle | B111: 300 | Q111: =SUM(RC[-15]:RC[-1]) -> 300 | S111: 0 | T111: =SUM(RC[-3]:RC[-1]) -> 300
A112: N-Dig0 | K112: 100 | Q112: =SUM(RC[-15]:RC[-1]) -> 100 | S112: 7575 | T112: =SUM(RC[-3]:RC[-1]) -> 7675
A113: Nick Salimes | F113: 200 | Q113: =SUM(RC[-15]:RC[-1]) -> 200 | S113: 0 | T113: =SUM(RC[-3]:RC[-1]) -> 200
A114: Nika Assaratta | I114: 200 | Q114: =SUM(RC[-15]:RC[-1]) -> 200 | S114: 0 | T114: =SUM(RC[-3]:RC[-1]) -> 200
A115: Odari Kimani | G115: 300 | Q115: =SUM(RC[-15]:RC[-1]) -> 300 | S115: 3610 | T115: =SUM(RC[-3]:RC[-1]) -> 3910
A116: Olivia Wine | H116: 200 | Q116: =SUM(RC[-15]:RC[-1]) -> 200 | S116: 0 | T116: =SUM(RC[-3]:RC[-1]) -> 200
A117: Page Metcalf | G117: 150 | Q117: =SUM(RC[-15]:RC[-1]) -> 150 | S117: 0 | T117: =SUM(RC[-3]:RC[-1]) -> 150
A118: Patricia Micetic | J118: 150 | Q118: =SUM(RC[-15]:RC[-1]) -> 150 | S118: 450 | T118: =SUM(RC[-3]:RC[-1]) -> 600
A119: Patrick Robbins | P119: 100 | Q119: =SUM(RC[-15]:RC[-1]) -> 100 | S119: ? 1800+ | T119: ? 1900+
A120: Paul Lorentz | G120: 200 | Q120: =SUM(RC[-15]:RC[-1]) -> 200 | S120: 0 | T120: =SUM(RC[-3]:RC[-1]) -> 200
A121: Petrovnia McIntosh | H121: 200 | Q121: =SUM(RC[-15]:RC[-1]) -> 200 | S121: 0 | T121: =SUM(RC[-3]:RC[-1]) -> 200
A122: Richard S. Bunk | G122: 150 | Q122: =SUM(RC[-15]:RC[-1]) -> 150 | S122: 0 | T122: =SUM(RC[-3]:RC[-1]) -> 150
A123: Robin Gee | E123: 150 | Q123: =SUM(RC[-15]:RC[-1]) -> 150 | S123: 0 | T123: =SUM(RC[-3]:RC[-1]) -> 150
A124: Ron Collins | I124: 150 | Q124: =SUM(RC[-15]:RC[-1]) -> 150 | S124: 1800 | T124: =SUM(RC[-3]:RC[-1]) -> 1950
A125: Sarah Whelan | J125: 200 | Q125: =SUM(RC[-15]:RC[-1]) -> 200 | S125: 0 | T125: =SUM(RC[-3]:RC[-1]) -> 200
A126: Scott Fraizer | K126: 75 | Q126: =SUM(RC[-15]:RC[-1]) -> 75 | S126: ? 2325 | T126: ? 2400+
A127: Sean Langenecker | D127: 200 | Q127: =SUM(RC[-15]:RC[-1]) -> 200 | S127: 200 | T127: =SUM(RC[-3]:RC[-1]) -> 400
A128: Sean McLean | F128: 200 | Q128: =SUM(RC[-15]:RC[-1]) -> 200 | S128: 0 | T128: =SUM(RC[-3]:RC[-1]) -> 200
A129: Sharon Milliken | J129: 50 | Q129: =SUM(RC[-15]:RC[-1]) -> 50 | S129: 0 | T129: =SUM(RC[-3]:RC[-1]) -> 50
A130: Sharon White | J130: 150 | Q130: =SUM(RC[-15]:RC[-1]) -> 150 | S130: 350 | T130: =SUM(RC[-3]:RC[-1]) -> 500
A131: Shaun Jacobs (Petts) | K131: 100 | P131: 100 | Q131: =SUM(RC[-15]:RC[-1]) -> 200 | S131: 6650 | T131: =SUM(RC[-3]:RC[-1]) -> 6850
A132: Simone LaPierre | E132: 100 | Q132: =SUM(RC[-15]:RC[-1]) -> 100 | S132: 525 | T132: =SUM(RC[-3]:RC[-1]) -> 625
A133: Stephanie Smith | D133: 150 | Q133: =SUM(RC[-15]:RC[-1]) -> 150 | S133: 0 | T133: =SUM(RC[-3]:RC[-1]) -> 150
A134: Susan Kurry | F134: 200 | Q134: =SUM(RC[-15]:RC[-1]) -> 200 | S134: 0 | T134: =SUM(RC[-3]:RC[-1]) -> 200
A135: Tess Klingele | B135: 200 | Q135: =SUM(RC[-15]:RC[-1]) -> 200 | S135: 0 | T135: =SUM(RC[-3]:RC[-1]) -> 200
A136: Tom Littrell | F136: 125 | Q136: =SUM(RC[-15]:RC[-1]) -> 125 | S136: 100 | T136: =SUM(RC[-3]:RC[-1]) -> 225
A137: Victoria Hurwitz | I137: 200 | Q137: =SUM(RC[-15]:RC[-1]) -> 200 | S137: 0 | T137: =SUM(RC[-3]:RC[-1]) -> 200
A138: Vimala Hile | E138: 200 | Q138: =SUM(RC[-15]:RC[-1]) -> 200 | S138: 0 | T138: =SUM(RC[-3]:RC[-1]) -> 200
A139: Weldon Kunzeman | H139: 150 | Q139: =SUM(RC[-15]:RC[-1]) -> 150 | S139: 0 | T139: =SUM(RC[-3]:RC[-1]) -> 150
A140: Wendi Marie Peters | I140: 200 | Q140: =SUM(RC[-15]:RC[-1]) -> 200 | S140: 0 | T140: =SUM(RC[-3]:RC[-1]) -> 200
A141: Zach Heise | I141: 200 | Q141: =SUM(RC[-15]:RC[-1]) -> 200 | S141: 0 | T141: =SUM(RC[-3]:RC[-1]) -> 200